<?xml version="1.0" encoding="UTF-8"?>
<list xmlns:xsi="http://www.w3.org/2001/XMLSchema-instance"  xmlns="http://l2j.org" xsi:schemaLocation="http://l2j.org clanHall.xsd" >
    <clanHall id="73" name="Black Barracks" grade="B" type="AUCTIONABLE">
        <auction min-bid="5000000" lease="500000"/>
        <npcs>
            36738 <!-- Ludina -->
            36737 <!-- Gairin -->
        </npcs>
        <doors>
            20230101
            20230102
        </doors>
        <restart-point x="17194" y="169658" z="-3486" />
        <banish-point x="18318" y="170344" z="-3501" />
    </clanHall>

    <clanHall id="74" name="Green Barracks" grade="B" type="AUCTIONABLE">
        <auction min-bid="5000000" lease="500000"/>
        <npcs>
            36740 <!-- Danif -->
            36739 <!-- Flon -->
        </npcs>
        <doors>
            20230103
            20230104
        </doors>
        <restart-point x="17965" y="170734" z="-3491" />
        <banish-point x="18318" y="170344" z="-3501" />
    </clanHall>
</list>